{
  "document_id": "huishan_tod_0409",
  "project_name": "惠山TOD项目",
  "page_reads": [
    {
      "page_index": 0,
      "page_label": "惠山TOD项目",
      "page_type": "cover",
      "read_summary": "封面页仅提供项目名称信息，不进入首轮空间诊断，但作为样本识别和报告引用的起点保留。",
      "key_objects": [
        "项目名称"
      ],
      "key_relations": [
        "封面页不参与规则比对"
      ],
      "confidence": 1.0
    },
    {
      "page_index": 1,
      "page_label": "总平面图",
      "page_type": "site_plan",
      "read_summary": "项目主体沿北侧和东侧展开，东侧面向高价值城市界面，南侧形成较完整的滨水景观空间，总平关系清楚地提示了TOD到达和场景资源的双重价值。",
      "key_objects": [
        "东侧主界面",
        "南侧滨水界面",
        "主体商业体量",
        "外部城市接驳关系"
      ],
      "key_relations": [
        "东侧城市界面与项目主要到达方向关系较强",
        "南侧滨水界面具备场景转化潜力",
        "总平层面已经显示出高价值界面的资源差异"
      ],
      "confidence": 0.84
    },
    {
      "page_index": 2,
      "page_label": "B2F平面图",
      "page_type": "basement_plan",
      "read_summary": "B2层以停车组织为主，地下轮廓和上部商业体量对应关系清楚，显示停车骨架完整，但是否与TOD项目的周转效率匹配仍需后续专项判断。",
      "key_objects": [
        "连续停车区",
        "地下轮廓边界",
        "停车交通组织"
      ],
      "key_relations": [
        "B2主要承担停车和地下支撑功能",
        "地下范围与上部商业边界较一致",
        "车位配置与TOD属性需要联合复核"
      ],
      "confidence": 0.88
    },
    {
      "page_index": 3,
      "page_label": "B1F平面图",
      "page_type": "basement_plan",
      "read_summary": "B1层并非单纯地库过渡层，而是具备连续商业带、主力功能区和节点空间的交通转化层，是惠山TOD平面里最值得重点研究的地下经营层。",
      "key_objects": [
        "B1连续商业带",
        "西侧主力功能区",
        "东端节点口部",
        "中段连续店铺带"
      ],
      "key_relations": [
        "西侧主力功能区与中段商业带形成牵引关系",
        "东端节点具备承接外部交通流量的潜力",
        "B1具备从交通层转向经营层的结构基础"
      ],
      "confidence": 0.83
    },
    {
      "page_index": 4,
      "page_label": "1F平面图",
      "page_type": "floor_plan",
      "read_summary": "首层形成较清晰的一字型主流线，西侧主力锚点、中部连续零售段和东端转折节点共同构成项目最核心的平面骨架。",
      "key_objects": [
        "西侧主力店",
        "中段主流线",
        "东端转折节点",
        "首层主界面"
      ],
      "key_relations": [
        "西侧主力店承担端部牵引作用",
        "东端转折节点与外部高价值界面关系密切",
        "首层是总平到楼层客流转化的关键承接层"
      ],
      "confidence": 0.91
    },
    {
      "page_index": 5,
      "page_label": "2F平面图",
      "page_type": "floor_plan",
      "read_summary": "二层在一字型骨架上叠加了多个中庭、连桥和扶梯节点，换层与聚客节奏最完整，是惠山TOD标准商业层里最强的体验层。",
      "key_objects": [
        "西端环形节点",
        "中部中庭",
        "东端椭圆节点",
        "连续扶梯系统",
        "连桥关系"
      ],
      "key_relations": [
        "多个节点沿主流线有节奏布置",
        "扶梯与节点空间耦合度较高",
        "二层是换层动力和空间识别最强的一层"
      ],
      "confidence": 0.92
    },
    {
      "page_index": 6,
      "page_label": "3F平面图",
      "page_type": "floor_plan",
      "read_summary": "三层维持主骨架连续性，但东端开始出现更复合的节点和异形边界，既具备体验强化可能，也带来端头效率和消极空间风险。",
      "key_objects": [
        "东端复合节点",
        "异形端头",
        "中高层连续主流线"
      ],
      "key_relations": [
        "东端复杂节点与主流线末端强相关",
        "高层端头效率与空间体验在这一层开始并存",
        "三层是高层风险显现的起点"
      ],
      "confidence": 0.78
    },
    {
      "page_index": 7,
      "page_label": "4F平面图",
      "page_type": "floor_plan",
      "read_summary": "四层整体铺位更完整，但东端支路和端头关系继续复杂化，是高层经营效率最需要复核的楼层之一。",
      "key_objects": [
        "东端支路",
        "端头空间",
        "复合节点",
        "高层店铺带"
      ],
      "key_relations": [
        "东端支路与端头关系比中段复杂",
        "支路过深或端头无效的风险较三层更强",
        "四层是高层端头效率校核的重点层"
      ],
      "confidence": 0.81
    },
    {
      "page_index": 8,
      "page_label": "5F平面图",
      "page_type": "floor_plan",
      "read_summary": "五层仍保持主要商业骨架和中庭关系，说明高层尚未完全脱离标准商业逻辑，但东端复杂区和高层吸附力问题仍需继续复核。",
      "key_objects": [
        "高层主骨架",
        "中部中庭",
        "东端复杂区",
        "高层铺位段"
      ],
      "key_relations": [
        "高层骨架延续低层逻辑",
        "东端复杂区在高层持续存在",
        "五层处于标准零售层向复合层转化前的过渡位置"
      ],
      "confidence": 0.77
    },
    {
      "page_index": 9,
      "page_label": "6F平面图",
      "page_type": "floor_plan",
      "read_summary": "六层不再是典型标准零售层，而更像大空间或复合功能层，中部开敞空间与两侧独立功能区关系明显，需要区别于低层零售逻辑单独解读。",
      "key_objects": [
        "中部开敞空间",
        "东侧独立功能区",
        "西侧独立功能区",
        "高层复合界面"
      ],
      "key_relations": [
        "六层空间组织明显区别于标准零售层",
        "高层功能开始向复合大空间转化",
        "六层多数标准零售规则应降权使用"
      ],
      "confidence": 0.75
    },
    {
      "page_index": 10,
      "page_label": "6F夹层平面图",
      "page_type": "floor_plan",
      "read_summary": "6F夹层进一步说明高层空间具有复合运营属性，多个夹层区域叠加在六层主空间之上，高层已形成独立于标准零售层的运营逻辑。",
      "key_objects": [
        "夹层区域",
        "高层复合空间",
        "局部运营界面",
        "叠加式空间组织"
      ],
      "key_relations": [
        "夹层与六层主空间构成复合运营关系",
        "高层空间需要与标准零售层分开理解",
        "夹层页适合用于功能转换和运营模式判断"
      ],
      "confidence": 0.74
    }
  ],
  "cross_page_understanding": [
    {
      "topic": "整体商业骨架",
      "statement": "项目以一字型骨架为主，西中东节点串联清晰，是一个骨架先行型商业平面。",
      "supporting_pages": [
        4,
        5,
        6,
        7,
        8
      ],
      "confidence": 0.93
    },
    {
      "topic": "TOD到达与导流",
      "statement": "项目东侧面向高价值城市界面和TOD到达方向，首轮应重点复核东侧主到达界面是否被充分转化为主入口、主节点与主流线资源。",
      "supporting_pages": [
        1,
        3,
        4
      ],
      "confidence": 0.76
    },
    {
      "topic": "B1交通转化",
      "statement": "B1层具备连续商业带和节点空间，不应被理解为纯交通层，而更应被视作TOD与停车客流的经营转化层。",
      "supporting_pages": [
        2,
        3,
        4
      ],
      "confidence": 0.84
    },
    {
      "topic": "高层东端风险",
      "statement": "三层至五层的东端复杂区是当前图纸中最可能出现经营效率偏弱、端头价值释放不足和消极支路风险的部位。",
      "supporting_pages": [
        6,
        7,
        8
      ],
      "confidence": 0.83
    },
    {
      "topic": "高层功能转化",
      "statement": "从五层到六层、六层夹层，项目开始由标准零售层逐步转向复合功能与大空间运营逻辑，高层解读不宜完全套用低层零售层的判断方法。",
      "supporting_pages": [
        8,
        9,
        10
      ],
      "confidence": 0.79
    }
  ],
  "confirmed_points": [
    "总平、B2、B1、1F、2F、3F、4F、5F、6F和6F夹层均已纳入读图包，无缺层。",
    "1F至5F都存在较明确的一字型主流线骨架。",
    "2F存在多个中庭或空洞型节点，是项目最强的换层体验层。",
    "西侧存在大面积主力功能区，且与B1、1F形成跨层牵引关系。",
    "3F至5F东端复杂度明显高于中段，是高层风险重点。",
    "6F和6F夹层已经显现出高层功能转化特征。"
  ],
  "inferred_points": [
    {
      "statement": "东侧大概率承担主到达界面角色。",
      "reason": "总平和首层转折关系支持这一判断，但缺少更清晰的入口标注和总图文字证据。"
    },
    {
      "statement": "三层东端复合区可能承载体验型或社交型功能。",
      "reason": "节点形态和空间组织显示其区别于标准零售段，但未读取到直接功能标注。"
    },
    {
      "statement": "六层和六层夹层更适合按复合运营层而非标准零售层进行评价。",
      "reason": "中部开敞空间、独立功能区和夹层叠加关系都显示该层级的运营逻辑已发生变化。"
    }
  ],
  "open_questions": [
    "主入口和次入口的精确位置分别在哪里？",
    "东侧高价值界面最终承接的是何种主力业态或展示界面？",
    "2F中庭和主次走道宽度是否满足建标下限？",
    "主流线长度与平均进深是否落在建标建议区间？",
    "高层复合区在6F和6F夹层的真实功能配置是什么？"
  ]
}
